id,evento,data,stagione
2,Fc sovescio riceve 3 crediti per la cessione in prestito di El Bilal Toure,2024-08-25,24-25
7,La squadra AC Ciaccati acquista Emerson Royal per 5 crediti,2024-08-14,24-25
8,Scambio ufficiale: Dialo porco riceve Skorupski; ZeroDayz FC riceve 5 crediti,2024-08-15,24-25
11,La squadra Ac ciaccati acquista Richardson per 1 credito,2024-08-16,24-25
12,ZeroDayz FC acquista Ryan ad 1 credito,2024-08-16,24-25
13,Scambio ufficiale: ZeroDayz FC riceve ramadani e busio; sborada riceve payero e 2 crediti,2024-08-16,24-25
14,Ac ciaccati acquista Kalulu per 1 credito,2024-08-17,24-25
19,"ZeroDayz FC riceve in prestito Mazzocchi (E, Napoli) prestito secco annuale con dir. risc. 3 crediti",2024-08-22,24-25
21,La squadra CYBERDUCKS acquista fofana per 12 crediti,2024-08-25,24-25
25,La squadra ac ciaccati acquista Brescianini per 10 crediti,2024-08-26,24-25
27,Fc Sovescio promuove dalla primavera Baldanzi,2024-08-27,24-25
28,La società Ac Ciaccati riceve 8 crediti per la cessione di Gendrey all'Hoffenheim,2024-08-27,24-25
33,Ac ciaccati acquista Conceicao per 3 crediti,2024-08-30,24-25
35,La società ZeroDayz FC riceve 2 crediti per il prestito di Amrabat al fenerbache,2024-08-30,24-25
36,Scambio ufficiale: ZeroDayz FC riceve Altare; Sborada riceve Magnani,2024-08-30,24-25
37,Baby Rejnders riceve 4 crediti per la cessione in prestito di Perez al Porto,2024-08-31,24-25
38,Sborada non riceve alcun credito per la cessione in prestito di Tavsan al Cesena,2024-08-31,24-25
44,Scambio: ac ciaccati riceve Chukwueze; beby rejnders riceve Brescianini,2024-08-31,24-25
47,Ac ciaccati acquistano di Gennaro a 1 credito,2024-08-31,24-25
50,La squadra Ac Ciaccati acquista kone per 18 crediti,2024-09-01,24-25
53,Sborada acquista Maripan per 2 crediti,2024-09-01,24-25
54,La squadra Sborada acquista Saelemekers per 7 crediti,2024-09-01,24-25
55,La società ZeroDayz FC acquista Keita per 1 credito,2024-09-01,24-25
56,La società ZeroDayz FC acquista Sergi Roberto per 1 credito,2024-09-01,24-25
57,Scambio: Cyberducks ricevono Delprato; sborada ricevono Piccoli,2024-09-01,24-25
58,ZeroDayz FC prende Raspadori a 1,2024-09-01,24-25
60,Dialo porco prendo sabelli a 1,2024-09-01,24-25
62,Ac ciaccati prende Abdulhamid a 1,2024-09-01,24-25
64,La società FC SOVESCIO riceve 0 crediti per la cessione di Smalling,2024-09-22,24-25
65,La società AC CIACCATI riceve 0 crediti per il prestito di Osimhen,2024-09-22,24-25
67,Sborada acquista hummels per 4 crediti,2025-01-05,24-25
68,Ac ciaccati acquista El Futbol Anjorin per 1 credito,2025-01-06,24-25
69,Sborada riceve 7 crediti per la cessione di Martinez Quarta al River Plate,2025-01-08,24-25
70,Ac ciaccati acquista Adli per 1 credito,2025-01-08,24-25
72,Dialo Porco acquista Cataldi per 1 credito,2025-01-10,24-25
74,Sborada acquista odgaard per 3 crediti,2025-01-14,24-25
75,Sborada riceve 3 crediti per cessione di Coulibaly al Leicester,2025-01-17,24-25
5,La squadra Baby Reijnders acquista Mandas per 1 credito,2024-08-13,24-25
32,La squadra baby Reijnders riceve 12 crediti per la cessione di Chiesa al Liverpool,2024-08-29,24-25
4,La squadra Cyberducks acquista Pinsoglio per 1 credito,2024-08-13,24-25
18,La squadra Cyberducks acquista Dia per 6 crediti,2024-08-19,24-25
10,Scambio ufficiale: Metodo Monchi FC riceve Tessmann e 13 crediti; Sborada riceve Ndoye,2024-08-15,24-25
66,La società Cyberducks riceve 0 crediti per la cessione di Mitrovic in prestito,2024-09-28,24-25
1,Scambio ufficiale: Diablitos FC riceve: Miretti + Viti (prestito con dir. risc. 4); Diaolo Porco riceve: Spinazzola + Oliveira (prestito con dir. risc. 10),2024-08-25,24-25
3,"Comunicato ufficiale: la società Diablitos FC svincola Rossi (P, Atalanta) al costo di 1 credito",2024-08-23,24-25
6,La squadra Diablitos FC acquista Rossi per 1 credito,2024-08-13,24-25
20,La società FC Pontos acquista Neres per 30 crediti,2024-08-23,24-25
26,La squadra FC Pontos acquista Toriani per 1 credito,2024-08-26,24-25
29,La squadra FC Pontos Acquista Pinamonti per 30 crediti,2024-08-27,24-25
43,FC Pontos acquista Giannetti a 1,2024-08-31,24-25
45,FC Pontos acquista karlsson per 2 crediti,2024-08-31,24-25
59,FC Sovescio prende almqvist a 1,2024-09-01,24-25
71,FC Sovescio acquista leali per 1 credito,2025-01-08,24-25
22,La squadra Metodo Monchi FC acquista Sosa per 1 credito,2024-08-25,24-25
31,La squadra Metodo Monchi FC riceve 6 crediti per la cessione di Tessmann al Lione,2024-08-28,24-25
46,Scambio prestiti: CYBERDUCKS ricevono Felici (oneroso 3cr); Metodo Monchi FC riceve Cutrone (gratuito con dr 15ml),2024-08-31,24-25
51,Metodo Monchi FC acquista nicolussi per 1 credito,2024-09-01,24-25
52,Metodo Monchi FC acquista gilmour per 6 crediti,2024-09-01,24-25
61,Scambio: sborada riceve fagioli (prestito oneroso); Metodo Monchi FC riceve 3 crediti,2024-09-01,24-25
78,La società ZeroDayz FC riceve 1 credito per la cessione di Ryan al Lens,2025-01-22,24-25
82,Dialo Porco riceve 0 crediti per la cessione di Oudin in prestito alla Sampdoria,2025-01-25,24-25
86,Dialo porco riceve 0 crediti per lo svincolo di Danilo da parte della Juventus,2025-01-27,24-25
87,ZeroDayz FC riceve 0 crediti per la cessione in prestito di Altare alla Sampdoria,2025-01-28,24-25
88,Ac ciaccati svincola Dahl (Dd E; Roma) al costo di 1 credito,2025-01-30,24-25
89,Sborada riceve 1 credito per la cessione di Magnani al Palermo,2025-01-31,24-25
90,Sborada promuove dalla primavera Urbanski,2025-01-31,24-25
91,Ac ciaccati acquista kempf a 1 credito,2025-01-31,24-25
93,Dialo porco acquista pezzella per 5 crediti,2025-02-01,24-25
95,CYBERDUCKS acquistano cacace per 1 credito,2025-02-02,24-25
96,ZeroDayz FC riceve 30 crediti per la cessione di Dorgu al Manchester United,2025-02-02,24-25
97,Baby rejnders riceve 6 crediti per la cessione in prestito di Morata al Galatasaray,2025-02-02,24-25
98,Scambio prestiti 6 mesi: ac ciaccati ricevono Piccoli e tete morente; sborada riceve Paredes,2025-02-03,24-25
106,Sborada riceve 0 crediti per la cessione di Mazzitelli in prestito al Sassuolo,2025-02-04,24-25
107,ZeroDayz FC acquista Elmas per 9 crediti,2025-02-04,24-25
111,Ac ciaccati acquista Guilbert per 1 credito,2025-02-05,24-25
114,Sborada acquista nelsson per 1 credito,2025-02-05,24-25
115,Sborada acquista candè per 1 credito,2025-02-05,24-25
117,ZeroDayz FC acquista Vogliacco per 1 credito,2025-02-05,24-25
124,Diaolo Porco esercita diritto riscatto su Oliveira (10 cr),2025-06-28,24-25
130,"Riepilogo CyberDucks: Svincoli (Sanchez, Malinovsky, Benedyczak), Cessioni (Coppola, Cacace...)",2025-07-01,25-26
131,"Riepilogo AC Ciaccati: Svincoli (Marchwinsky, Kempf, Richardson)",2025-07-01,25-26
133,"Riepilogo Baby Reijnders: Svincoli (Livramento, Fadera, Shomurodov), Cessioni (Zampano, Lazovic...)",2025-07-01,25-26
134,La squadra ZeroDayz FC riceve 17 crediti per la cessione di Ruggeri all'Atletico,2025-07-01,25-26
136,"Riepilogo Diaolo Porco: Svincoli (Masina, Badelj), Promozioni (Prati)",2025-07-02,25-26
140,ZeroDayz FC riceve 1 credito per la cessione in prestito di Rafa Marin al Villareal,2025-07-06,25-26
142,Baby Reijnders acquista De Bruyne per 49 crediti,2025-07-08,25-26
143,ZeroDayz FC svincola Sergi Roberto al costo di 1 credito,2025-07-09,25-26
144,ZeroDayz FC acquista Vitik a 24 crediti,2025-07-09,25-26
148,Baby Reijnders acquista David (Juventus) per 74 crediti,2025-07-10,25-26
81,Baby Reijnders riceve 1 credito per la cessione di Kayode in prestito al Brentford,2025-01-25,24-25
83,Cyberducks svincola Gagliardini (M C; Monza) al costo di 1 credito,2025-01-25,24-25
102,Cyberducks riceve 4 crediti per la cessione di Dani Silva,2025-02-04,24-25
103,Cyberducks riceve 1 credito per la cessione in prestito di Bennacer al Marsiglia,2025-02-04,24-25
125,Diablitos FC esercita diritto riscatto su Viti (4 cr),2025-06-29,24-25
128,"Riepilogo Diablitos FC: Svincoli (Vecino, El Shaarawy), Cessioni (Rui Patricio, Musso, Calabria...)",2025-07-01,25-26
141,Scambio: Diablitos FC riceve Miranda; Baby Reijinders riceve 23 crediti,2025-07-07,25-26
80,FC Pontos riceve 2 crediti per la cessione di Djuric al Parma,2025-01-23,24-25
85,FC Pontos acquista Walker per 7 crediti,2025-01-27,24-25
109,Scambio: ZeroDayz FC riceve Dossena (prestito) e Ruggeri; Metodo Monchi FC riceve Acerbi (prestito) e 19 crediti,2025-02-04,24-25
100,FC Pontos riceve 0 crediti per la cessione di belotti in prestito al Benfica,2025-02-03,24-25
104,FC Pontos riceve 5 crediti per la cessione di Pohjanpalo al Palermo,2025-02-04,24-25
137,FC Pontos riceve 15 crediti per la cessione di Tchaouna al Barnley,2025-07-02,25-26
79,ZeroDayz FC acquista Gollini per 3 crediti dalla squadra FC Sovescio ,2025-01-23,24-25
92,Scambio: FC Sovescio riceve Pellegrini; dialo porco riceve Rovella,2025-02-01,24-25
94,FC Sovescio acquista bianco per 1 credito,2025-02-02,24-25
105,FC Sovescio riceve 0 crediti per la cessione di Audero in prestito al Palermo,2025-02-04,24-25
110,Sborada riceve in prestito per 6 mesi Dany Mota da FC Sovescio,2025-02-04,24-25
112,FC Sovescio acquista Joao Felix per 27 crediti,2025-02-05,24-25
113,FC Sovescio acquista sava per 1 credito,2025-02-05,24-25
118,FC Sovescio compra pedro pereira a 1 credito,2025-02-05,24-25
77,Metodo Monchi FC riceve 70 crediti per la cessione di Kvara al PSG,2025-01-17,24-25
84,Metodo Monchi FC acquista Kolo Muani per 23 crediti,2025-01-26,24-25
101,Metodo Monchi FC e Sborada terminano in anticipo il prestito di fagioli,2025-02-03,24-25
108,Metodo Monchi FC acquista Gimenez per 45 crediti,2025-02-04,24-25
119,Metodo Monchi FC acquista kelly per 15 crediti,2025-02-06,24-25
123,Metodo Monchi FC Promuove Scalvini dalla primavera alla prima squadra,2025-06-23,24-25
132,"Riepilogo Metodo Monchi FC: Svincoli (Gilmour, Felici, Dossena), Cessioni (Kelly, Bijol, Sosa...)",2025-07-01,25-26
99,Scambio: Metodo Monchi FC riceve Oristanio; sborada riceve Lobotka; FC Pontos riceve Beltran,2025-02-03,24-25
129,"Riepilogo ZeroDayz FC: Svincoli (Pierret, Harroui, Kouamè), Cessioni (Amrabat, Busio, Altare)",2025-07-01,25-26
150,ZeroDayz FC acquista Baturina (Como) per 33 crediti,2025-07-12,25-26
152,Diaolo Porco acquista Dzeko (Fiorentina) per 7 crediti,2025-07-14,25-26
153,AC Ciaccati riceve 3 crediti per la cessione di Paredes al Boca Juniors,2025-07-14,25-26
154,Scambio: Sborada riceve Folorunsho + 32 crediti; Diablitos FC riceve Ndoye,2025-07-15,25-26
156,FC Pontos acquista Immobile (Bologna) a 8 crediti,2025-07-18,25-26
157,Diaolo Porco acquista Kuhn (Como) a 27 crediti,2025-07-19,25-26
158,Cyberducks riceve 2 crediti per la cessione di Mihaila al Rizespor,2025-07-20,25-26
159,FC Pontos acquista Lang a 66 crediti,2025-07-20,25-26
160,Diablitos FC riceve 68 crediti per la cessione di Retegui ad Al Qaida,2025-07-21,25-26
161,Baby Reijnders acquista Harroui a 1 credito,2025-07-21,25-26
162,Baby Reijnders riceve 2 crediti per la cessione in prestito di Abraham al Besiktas,2025-07-21,25-26
163,AC Ciaccati acquista Thorsvedt a 15 crediti,2025-07-24,25-26
165,ZeroDayz FC acquista El Aynaoui a 16 crediti,2025-07-26,25-26
166,Sborada acquista Casadei a 23 crediti,2025-07-26,25-26
167,AC Ciaccati riceve 9 crediti per la cessione di Emerson Royal al Flamengo,2025-07-27,25-26
168,Diaolo Porco riceve 2 crediti per la cessione di Pezzella alla Cremonese,2025-07-28,25-26
170,ZeroDayz FC svincola Vogliacco (Genoa) per 2 crediti,2025-07-29,25-26
174,Dialo Porco svincola Oudin (Lecce) al costo di 1 credito,2025-07-31,25-26
175,Diablitos FC riceve 42 crediti per la cessione di Ndoye al Nottingham Forest,2025-07-31,25-26
176,Diablitos FC acquista Estupinian a 31 crediti,2025-07-31,25-26
177,Ac Ciaccati riceve 75 crediti dalla cessione di Osimehn,2025-07-31,25-26
178,Sborada riceve 8 crediti per la cessione di Strefezza,2025-07-31,25-26
180,Diaolo Porco acquista Ravaglia a 1 credito,2025-08-01,25-26
181,Ac ciaccati acquista Aboukhlal per 1 credito,2025-08-01,25-26
183,Sborada riceve 0 crediti per la cessione in prestito di Tavsan alla Reggiana,2025-08-02,25-26
184,Cyberducks acquista Kelly per 1 credito,2025-08-02,25-26
185,Sborada acquista Tramoni a 10 crediti,2025-08-02,25-26
186,Diablitos FC acquista Gronbaek a 26 crediti,2025-08-02,25-26
187,Diablitos FC acquista Sucic a 21 crediti,2025-08-03,25-26
188,Cyberducks acquista Pezzella per 8 crediti,2025-08-03,25-26
189,Diaolo porco acquista Caqueret per 6 crediti,2025-08-04,25-26
190,Diablitos FC riceve 5 crediti dalla cessione di Erlic al Midtiylland,2025-08-04,25-26
191,Sborada acquista Muharemovic per 12 crediti,2025-08-04,25-26
192,Sborada acquista Valentini per 3 crediti,2025-08-04,25-26
197,ZeroDayz FC riceve 22 crediti perla cessione di Raspadori all'Atletico Madrid,2025-08-11,25-26
198,Baby Reijnders acquista Atta a 12 crediti,2025-08-12,25-26
199,Baby Reijnders riceve 6 crediti per la cessione di Thauvin al Lens,2025-08-12,25-26
200,Baby Reijnders riceve 9 crediti per la cessione di Man al PSV,2025-08-12,25-26
201,Ac Ciaccati acquista Pellegrino a 1 credito,2025-08-12,25-26
202,Sovecio riceve 35 crediti per la cessione di Thiaw al Newcastle,2025-08-13,25-26
203,Diablitos FC acquista Lazaro a 1 credito,2025-08-13,25-26
204,Diablitos FC acquista Kone a 1 credito,2025-08-15,25-26
205,ZeroDayz FC acquista Dominguez per 31 crediti,2025-08-17,25-26
206,Ac ciaccati acquista Pierotti per 1 credito,2025-08-17,25-26
207,Scambio prestiti: cyberducks riceve Keita + 3 crediti; ZeroDayz FC riceve sohm,2025-08-17,25-26
208,Sborada riceve 13 crediti per la cessione di Tchatchoua ai Wolves,2025-08-19,25-26
209,Ac ciaccati svincola Abdulhamid al costo di 1 crediti,2025-08-19,25-26
210,Sborada acquista Barbieri a 1,2025-08-21,25-26
211,Diaolo porco riceve 19 crediti per la cessione di Okafor al Leeds,2025-08-21,25-26
212,Diablitos FC acquista Gutierrez a 23 crediti,2025-08-21,25-26
214,Baby Reijnders acquista Terraciano (Cremonese) a 1 credito,2025-08-22,25-26
215,FC Pontos acquista Collocolo a 1 credito,2025-08-22,25-26
217,Diaolo porco acquista kempf a 1 credito,2025-08-23,25-26
219,Diaolo porco acquista Unai Nunez a 5 crediti,2025-08-23,25-26
221,Sborada acquista Canestrelli a 5 crediti,2025-08-23,25-26
222,FC Pontos acquista Vandeputte a 1 credito,2025-08-24,25-26
225,Diablitos FC acquista Rowe a 35 crediti,2025-08-28,25-26
151,Cyberducks acquista Lauriente (Sassuolo) per 23 crediti,2025-07-12,25-26
224,Ac ciaccati cede Vlasic ad ZeroDayz FC (24cr + 2 bonus),2025-08-27,25-26
164,FC Pontos riceve 2 crediti per la cessione di Marin al AEK di Atene,2025-07-24,25-26
196,"Diablitos FC cede Estupinan a FC Pontos (prestito oneroso 9cr, dir risc 35cr)",2025-08-11,25-26
155,FC Sovescio acquista Modric (Milan) per 9 crediti,2025-07-17,25-26
169,FC Sovescio riceve 2 crediti per la cessione di Bani al Palermo,2025-07-28,25-26
173,Scambio: ZeroDayz FC riceve samardzic; FC Sovescio riceve 17 crediti,2025-07-31,25-26
182,FC Sovescio acquista Israel per 21 crediti,2025-08-01,25-26
149,Metodo Monchi FC acquista Berardi (Sassuolo) per 56 crediti,2025-07-11,25-26
171,Metodo Monchi FC acquista Wesley a 40 crediti,2025-07-31,25-26
193,Metodo Monchi FC acquista Ostigard per 2 crediti,2025-08-06,25-26
194,Metodo Monchi FC riceve 1 credito per la cessione in prestito di Weah al Marsiglia,2025-08-06,25-26
218,Scambio: Metodo Monchi FC riceve gaspar; ZeroDayz FC riceve 6 crediti + prestito de Vrij (con opzioni),2025-08-23,25-26
172,Maxi Scambio a 3: Diablitos FC riceve Gudmunson + 30cr; Metodo Monchi FC riceve DeKatelare; ZeroDayz FC riceve Dybala + Dodo,2025-07-31,25-26
228,Diablitos FC acquista Troilio a 1 credito,2025-08-30,25-26
229,Scambio prestiti: Diablitos FC riceve Torriani; FC Pontos riceve Miretti,2025-08-30,25-26
230,Ac ciaccati riceve 2 crediti per la cessione di taremi all'olympiacos,2025-08-31,25-26
232,Diaolo Porco svincola Bove al costo di 1 credito,2025-09-01,25-26
233,Sborada svincola terracciano al costo di 1 credito,2025-09-01,25-26
234,Ac ciaccati svincola Guilbert a 1 credito,2025-09-01,25-26
235,Scambio prestiti: Sborada riceve Sabelli e Spinazzola; Diaolo Porco riceve Asllani e Cristante,2025-09-01,25-26
236,Ac ciaccati riceve 3 crediti per la cessione di Luiz in prestito al Nottingham,2025-09-01,25-26
239,"FC Pontos, in accordo con Diablitos FC termina anticipatamente il prestito di Torriani",2025-09-01,25-26
240,Ac ciaccati svincola Adli per 1 credito,2025-09-01,25-26
241,Diablitos FC svincola Suslov pagando 4 crediti,2025-09-01,25-26
245,AC Ciaccati riceve 0 crediti per la cessione in prestito di Cukweze al Fulham,2025-09-02,25-26
246,Sborada acquista Lezzerini a 1 credito,2025-09-02,25-26
247,Sborada acquista Martinelli a 1 credito,2025-09-02,25-26
249,FC Pontos cede in prestito gratuito Alberto Moreno alla squadra Diablitos FC,2025-09-02,25-26
252,Scambio: FC Pontos riceve Ricci e 10 crediti; Diablitos FC riceve Chalanoglu,2025-09-02,25-26
254,Scambio: Sborada Riceve Pellegrino; AC Ciaccati riceve Odgard,2025-09-02,25-26
255,Zerodayz FC acquista Toure a 1 credito,2025-09-03,25-26
256,Diaolo Porco acquista Juan Jesus a 1 credito,2025-09-03,25-26
257,Ac Ciaccati acquista Hojlund a 70 crediti,2025-09-03,25-26
258,Cyberducks riceve 0 crediti per la cessione in prestito di Mitrovic all'Excelsior,2025-09-04,25-26
259,Ac Ciaccati acquista Rabiot a 41 crediti,2025-09-04,25-26
260,Diablitos FC acquista Zhegrova a 50 crediti,2025-09-04,25-26
262,Ac Ciaccati acquista Bailey a 25 crediti,2025-09-04,25-26
263,Diablitos FC acquista Sportiello a 1 credito,2025-09-04,25-26
264,Ac ciaccati acquista Joao Mario a 1,2025-09-04,25-26
265,Ac ciaccati acquista Karlstrom a 1,2025-09-04,25-26
267,Baby Reijnders acquista Semper a 1 crediti,2025-09-05,25-26
268,Cyberducks riceve 0 crediti per la cessione in prestito di Bennacer alla Dinamo Zagabria,2025-09-05,25-26
269,Baby Reijnders acquista Kostic a 1 credito,2025-09-05,25-26
270,Sborada acquista Perrone a 20 crediti,2025-09-05,25-26
271,Cyberducks acquista Akanji a 14 crediti,2025-09-05,25-26
272,Baby Reijnders acquista Zalewski a 23 crediti,2025-09-05,25-26
274,Sborada svincola Noslin pagando 3 crediti,2025-09-08,25-26
275,Sborada acquista Giovane ad 1 credito,2025-09-10,25-26
277,Diablitos FC acquista Pedersen a 1,2025-09-10,25-26
282,Sborada svincola payero al costo di 2 crediti,2025-09-20,25-26
283,Sborada acquista Orban a 5 crediti,2025-09-23,25-26
284,AC Ciaccati acquista Ellertsson a 1 credito,2025-09-29,25-26
285,FC Pontos acquista Sulemana a 9 crediti,2025-10-01,25-26
286,AC Ciaccati acquista Celik a 1 credito,2025-11-25,25-26
287,Diablitos FC acquista Muric a 1 credito,2026-01-01,25-26
288,Diaolo Porco riceve 29 crediti per la cessione di Castelanos al West Ham,2026-01-05,25-26
290,Diaolo Porco acquista Simeone per 3 crediti,2026-01-10,25-26
291,Sborada riceve 1 credito per la cessione di urbanski al Legia Varsavia,2026-01-13,25-26
292,Diaolo Porco acquista Taylor per 36 crediti,2026-01-18,25-26
293,AC Ciaccati svincola Anjorin per 1 credito,2026-01-19,25-26
294,Sborada riceve 2 crediti per la cessione di Tavsan,2026-01-20,25-26
296,Sborada riceve 0 crediti per la cessione di Martinelli in prestito alla Sampdoria,2026-01-21,25-26
40,Cyberducks acquistano Lukaku per 36 crediti,2024-08-31,24-25
49,Cyberducks acquistano mcTominay a 25 crediti,2024-09-01,24-25
295,Diablitos FC riceve 0 crediti per la fine del prestito di Viti,2026-01-20,25-26
48,Baby Reijnders acquista Kossounou per 11 crediti,2024-09-01,24-25
73,Baby Reijnders acquista Solet per 3 crediti,2025-01-12,24-25
116,Baby Reijnders acquista shomorudov per 4 crediti,2025-02-05,24-25
120,Baby Reijnders acquista fadera per 9 crediti,2025-02-06,24-25
121,Baby Reijnders acquista djuric per 2 crediti,2025-02-06,24-25
220,Baby Reijnders acquista Stanciu a 8 crediti,2025-08-23,25-26
122,Cyberducks promuove Fazzini dalla primavera alla prima squadra,2025-06-14,24-25
15,Scambio ufficiale: Diablitos FC riceve Suslov + 13 crediti; Baby Reijnders riceve Pavlovic,2024-08-17,24-25
242,FC Pontos riceve 1 credito per la cessione di Beltran in prestito al Valencia,2025-09-02,25-26
244,FC Pontos riceve 0 crediti per la cessione in prestito di Karlsson al Aberdeen,2025-09-02,25-26
279,FC Pontos acquista Angori ad 1,2025-09-11,25-26
237,FC Sovescio riceve 1 credito per la cessione in prestito di Nico Gonzalez all'Atletico di Madrid,2025-09-01,25-26
238,FC Sovescio non riceve alcun credito per la cessione in prestito di Bianco al Paok,2025-09-01,25-26
251,FC Sovescio acquista vrackx a 1,2025-09-02,25-26
231,Metodo Monchi FC acquista Hermoso a 1 credito,2025-08-30,25-26
250,Scambio prestiti con obbligo (3cr): Diablitos FC riceve Hermoso; Metodo Monchi FC riceve Troilo,2025-09-02,25-26
253,Metodo Monchi FC acquista Butez a 7 crediti,2025-09-02,25-26
276,Metodo Monchi FC acquista Provstagaard per 1 credito,2025-09-10,25-26
278,Metodo Monchi FC acquista Masini per 1 credito,2025-09-11,25-26
281,Metodo Monchi FC acquista Heggem a 4 crediti,2025-09-20,25-26
273,Zerodayz FC acquista Vardy a 1 credito,2025-09-07,25-26
135,Scambio: Cyberducks riceve Piccoli; Sborada riceve Del Prato,2025-07-01,25-26
138,Cyberducks acquista Ghilardi per 6 cr,2025-07-04,25-26
216,Cyberducks riceve 0 crediti per la cessione in prestito di Godfrey allo Sheffield,2025-08-22,25-26
243,Cyberducks riceve 3 crediti per la cessione in prestito di Pavard al Marsiglia,2025-09-02,25-26
280,Cyberducks acquista van der Brempt a 1 crediti,2025-09-12,25-26
9,La squadra Diablitos FC acquista Birindelli ad 1,2024-08-15,24-25
23,La squadra Diablitos FC acquista Turati per 1 credito,2024-08-25,24-25
30,La società Diablitos FC riceve 2 crediti per il prestito di Musso,2024-08-27,24-25
34,Scambio: Diablitos FC riceve prestito oneroso (1cr) con dr (2cr) Pierret da ZeroDayz FC,2024-08-30,24-25
39,Scambio: Diablitos FC riceve Ferguson; Sborada riceve Kolasinac + 11 crediti,2024-08-31,24-25
41,Diablitos FC acquista Rui Patricio per 1 credito,2024-08-31,24-25
42,Diablitos FC acquista Ranieri a 1 credito,2024-08-31,24-25
179,Diablitos FC acquista Bernardeschi ad 1 credito,2025-08-01,25-26
127,"Riepilogo FC Pontos: Svincoli (Osorio, Caprari), Promozioni (Shpendi), Cessioni (Kyriakopoulos, Walker)",2025-07-01,25-26
139,FC Pontos acquista Bertola per 11 crediti,2025-07-05,25-26
227,FC Pontos riceve 1 credito per la cessione all'Antalyaspor di Giannetti,2025-08-30,25-26
126,"Riepilogo FC Sovescio: Svincoli (Mazzocchi, Almquist, Vitinha), Promozioni (Bondo), Cessioni (Le Fee, Reijnders...)",2025-07-01,25-26
145,FC Sovescio acquista Doig a 1 credito,2025-07-09,25-26
146,FC Sovescio acquista Rensch a 1 credito,2025-07-09,25-26
147,FC Sovescio riceve 25 crediti per la cessione di Theo Hernandez al Al-Hilal,2025-07-10,25-26
195,FC Sovescio acquista Jashari a 31 credti,2025-08-09,25-26
213,FC Sovescio acquista Walukiewicz a 5 crediti,2025-08-22,25-26
223,"Ac ciaccati cede Dele Bashiru in prestito a FC Sovescio (20cr, obbligo 5cr)",2025-08-25,25-26
226,FC Sovescio riceve 3 crediti per la cessione in prestito di El Bilal Toure al Besikta,2025-08-29,25-26
261,FC Sovescio acquista Nkunku a 53 crediti,2025-09-04,25-26
266,FC Sovescio acquista Openda a 53 crediti,2025-09-04,25-26
76,"Cessioni prestito estero (0 crediti): Godfrey (Cyberducks), Le fee (FC Sovescio )",2025-01-17,24-25
63,Metodo Monchi FC prende gosens a 7,2024-09-01,24-25
24,Scambio ufficiale: Cyberducks riceve Cambiaghi (prestito con dr 11); Metodo Monchi FC riceve Dani Silva (prestito con dr 3),2024-08-26,24-25
16,Metodo Monchi FC acquista Cambiaghi per 1 credito,2024-08-17,24-25
17,Metodo Monchi FC acquista beltran per 1 credito,2024-08-17,24-25
289,Metodo Monchi FC riceve 28 crediti per la cessione di Guendouzi al Fenerbahce,2026-01-09,25-26
248,Metodo Monchi FC cede in prestito gratuito Cabal alla squadra Cyberducks ,2025-09-02,25-26
299,"📢 COMUNICAZIONE UFFICIALE: La squadra Sborada acquista il giocatore Malen per 66 crediti.
",2026-01-22,25-26
298,"📢 COMUNICAZIONE UFFICIALE: La squadra CyberDucks acquista il giocatore Raspadori per 19 crediti.
",2026-01-22,25-26
301,"📢 COMUNICAZIONE UFFICIALE:📝La squadra ZeroDayz FC libera lo slot di Posch a causa del suo trasferimento in prestito e recupera 0 crediti. 
",2026-01-22,25-26
310, 📢 COMUNICAZIONE UFFICIALE:  📝La squadra FC Pontos svincola Marì a causa del suo trasferimento/svincolo e recupera 2 crediti.  ,2026-01-24,25-26
305,"📢 PRESTITO UFFICIALE:
👤 Oristanio

🔴 Da: Metodo Monchi FC
🟢 A: FC Sovescio
📅 Scadenza: 30/06/2026 12:00
",2026-01-22,25-26
306,"🆙 COMUNICAZIONE UFFICIALE: La squadra Diaolo Porco promuove in prima squadra il giocatore Norton-Cuffy
",2026-01-23,25-26
308,"📢 COMUNICAZIONE UFFICIALE: 📝La squadra Diaolo Porco svincola Unai Nunez a causa del suo trasferimento/svincolo e recupera 0 crediti. 
",2026-01-24,25-26
309,📢 COMUNICAZIONE UFFICIALE: 📝La squadra FC Pontos libera lo slot di Lang a causa del suo trasferimento in prestito e recupera 2 crediti.  ,2026-01-24,25-26
307,"📢 COMUNICAZIONE UFFICIALE:📝La squadra Diablitos FC svincola Lucca a causa del suo trasferimento/svincolo e recupera 35 crediti. 
",2026-01-23,25-26
300,"📢 COMUNICAZIONE UFFICIALE:📝La squadra Diaolo Porco svincola Dzeko a causa del suo trasferimento/svincolo e recupera 0 crediti. 
",2026-01-22,25-26
311, 📢 PRESTITO UFFICIALE:  👤 Delprato  🔴 Da: Sborada 🟢 A: Metodo Monchi FC 📅 Scadenza: 30/06/2026 12:00 🧾 Tipo: Con diritto di riscatto 💸 Costo prestito: 2 🪙 Riscatto: 4 📝 Note: Nessuna nota. ,2026-01-25,25-26
313, 🏷️ ASTA: Malinovskyi La squadra Metodo Monchi FC ha iniziato un'asta! 📆 Hai tempo per iscriverti fino a: 27/01/2026 11:59. ,2026-01-26,25-26
314, 📢 SCAMBIO UFFICIALE: 🔥 Le squadreMetodo Monchi FC e Sborada hanno trovato concluso un scambio:  ✅ **Metodo Monchi FC** riceve: ⚽ Giovane (+🪙 0 cr.)  ✅ **Sborada** riceve: ⚽ [] (+🪙 20 cr.)  📝 Condizioni/Bonus: Nessuna Condizione. ,2026-01-26,25-26
315, ✂️ COMUNICAZIONE UFFICIALE:  La squadra FC Sovescio svincola il giocatore Sava pagando 1 crediti. ,2026-01-27,25-26
